{
  "meta": {
    "titulo": "Los 79 de 2023",
    "subtitulo": "Muertes y desapariciones documentadas en 2023 atribuidas al Estado cubano",
    "actualizado": "2026-07-01",
    "periodo": "año 2023",
    "fuentePrincipal": "Archivo Cuba & American Museum of the Cuban Diaspora · Proyecto de Verdad y Memoria (feb. 2024)",
    "advertencia": "Trabajo en progreso. Archivo Cuba solo documenta casos con datos suficientes: se sabe que el número real de víctimas es considerablemente mayor. Otros 59 casos reportados en 2023 no pudieron documentarse por falta de datos."
  },
  "kpis": [
    {
      "id": "documentados",
      "valor": 79,
      "etiqueta": "muertes y desapariciones documentadas en 2023",
      "sufijo": "trabajo en progreso"
    },
    {
      "id": "sinDocumentar",
      "valor": 59,
      "etiqueta": "casos más reportados, aún sin documentar",
      "sufijo": "por falta de datos"
    },
    {
      "id": "migrantes",
      "valor": 34,
      "etiqueta": "migrantes en busca de asilo",
      "sufijo": "la categoría mayor"
    },
    {
      "id": "custodia",
      "valor": 22,
      "etiqueta": "muertes bajo custodia del Estado",
      "sufijo": "cárcel, hospital penal, comisaría"
    }
  ],
  "resumen": {
    "totalDocumentado": 79,
    "totalReportado": 138,
    "sinDocumentar": 59,
    "nota": "Cinco categorías. Los subtotales sombreados son estimaciones de la propia fuente: «algunos casos podrían ser ejecuciones extrajudiciales».",
    "categorias": [
      {
        "id": "extrajudicial",
        "etiqueta": "Asesinatos extrajudiciales",
        "n": 9,
        "sub": []
      },
      {
        "id": "custodia",
        "etiqueta": "Otras muertes en custodia",
        "n": 22,
        "sub": [
          {
            "etiqueta": "Denegación de atención médica",
            "n": 14
          },
          {
            "etiqueta": "Suicidio*",
            "n": 6
          },
          {
            "etiqueta": "Negligencia",
            "n": 1
          },
          {
            "etiqueta": "Huelga de hambre",
            "n": 1
          }
        ]
      },
      {
        "id": "smo",
        "etiqueta": "Muertes en servicio militar obligatorio",
        "n": 11,
        "sub": [
          {
            "etiqueta": "Accidente",
            "n": 6
          },
          {
            "etiqueta": "Suicidio",
            "n": 3
          },
          {
            "etiqueta": "Razones médicas",
            "n": 2
          }
        ]
      },
      {
        "id": "internacionalista",
        "etiqueta": "«Internacionalistas» en misión",
        "n": 3,
        "sub": [
          {
            "etiqueta": "Razones médicas",
            "n": 2
          },
          {
            "etiqueta": "Accidente",
            "n": 1
          }
        ]
      },
      {
        "id": "migrante",
        "etiqueta": "Migrantes en busca de asilo",
        "n": 34,
        "sub": [
          {
            "etiqueta": "Ahogados",
            "n": 12
          },
          {
            "etiqueta": "Muertos en accidentes",
            "n": 11
          },
          {
            "etiqueta": "Desaparecidos",
            "n": 8
          },
          {
            "etiqueta": "Razones médicas",
            "n": 2
          },
          {
            "etiqueta": "Asesinado",
            "n": 1
          }
        ]
      }
    ]
  },
  "casos": [
    {
      "id": "c01",
      "nombre": "Aiser Roque Rivero",
      "edad": 18,
      "fecha": "2023-02-05",
      "fechaAprox": false,
      "cat": "extrajudicial",
      "sub": null,
      "prov": "CU-05",
      "lugar": "Placetas, Villa Clara",
      "pais": "Cuba",
      "salida": null,
      "ruta": null,
      "estado": "muerto",
      "detalle": "Muerto bajo custodia policial, supuesto suicidio horas tras su arresto por violencia doméstica. Había participado en las protestas del 11J."
    },
    {
      "id": "c02",
      "nombre": "Sergio Pozo Hernández",
      "edad": 30,
      "fecha": "2023-02-26",
      "fechaAprox": false,
      "cat": "extrajudicial",
      "sub": null,
      "prov": "CU-13",
      "lugar": "Santiago de Cuba",
      "pais": "Cuba",
      "salida": null,
      "ruta": null,
      "estado": "muerto",
      "detalle": "Golpeado por dos policías por no detenerse en un control de carretera a la salida de una playa."
    },
    {
      "id": "c03",
      "nombre": "Kevin Canlo Morales",
      "edad": null,
      "fecha": "2023-03-15",
      "fechaAprox": true,
      "cat": "extrajudicial",
      "sub": null,
      "prov": "CU-15",
      "lugar": "prisión de Quivicán, Mayabeque",
      "pais": "Cuba",
      "salida": null,
      "ruta": null,
      "estado": "muerto",
      "detalle": "Murió bajo custodia tras una brutal paliza a manos del subdirector de la prisión."
    },
    {
      "id": "c04",
      "nombre": "Ernesto Miranda",
      "edad": 18,
      "fecha": "2023-03-15",
      "fechaAprox": true,
      "cat": "extrajudicial",
      "sub": null,
      "prov": "CU-03",
      "lugar": "unidad de artillería, La Habana",
      "pais": "Cuba",
      "salida": null,
      "ruta": null,
      "estado": "muerto",
      "detalle": "Murió cumpliendo el servicio militar obligatorio; su familia refutó el informe oficial de supuesto suicidio."
    },
    {
      "id": "c05",
      "nombre": "Jeankarlos López López",
      "edad": 22,
      "fecha": "2023-03-30",
      "fechaAprox": false,
      "cat": "extrajudicial",
      "sub": null,
      "prov": "CU-03",
      "lugar": "Combinado del Este, La Habana",
      "pais": "Cuba",
      "salida": null,
      "ruta": null,
      "estado": "muerto",
      "detalle": "Se quejaba de dolor en el pecho; murió escoltado hacia la clínica. El cadáver mostraba visibles hematomas."
    },
    {
      "id": "c06",
      "nombre": "Dra. Damixi Rodríguez Domínguez",
      "edad": null,
      "fecha": "2023-05-01",
      "fechaAprox": false,
      "cat": "extrajudicial",
      "sub": null,
      "prov": "CU-13",
      "lugar": "Santiago de Cuba",
      "pais": "Cuba",
      "salida": null,
      "ruta": null,
      "estado": "muerto",
      "detalle": "Baleada en una ambulancia contra la que un oficial de policía, su ex pareja, arremetió a tiros."
    },
    {
      "id": "c07",
      "nombre": "Rafael Rodríguez",
      "edad": 29,
      "fecha": "2023-05-04",
      "fechaAprox": false,
      "cat": "extrajudicial",
      "sub": null,
      "prov": null,
      "lugar": "Cuba (provincia no precisada)",
      "pais": "Cuba",
      "salida": null,
      "ruta": null,
      "estado": "muerto",
      "detalle": "Cuentapropista asesinado por un policía investigativo «en defensa propia»; disparo por la espalda y señas de golpiza."
    },
    {
      "id": "c08",
      "nombre": "Luis Miguel Bartoló Tamayo",
      "edad": null,
      "fecha": "2023-05-28",
      "fechaAprox": false,
      "cat": "extrajudicial",
      "sub": null,
      "prov": "CU-13",
      "lugar": "Santiago de Cuba",
      "pais": "Cuba",
      "salida": null,
      "ruta": null,
      "estado": "muerto",
      "detalle": "Muerto en un tiroteo policial contra una ambulancia en Santiago."
    },
    {
      "id": "c09",
      "nombre": "Joelvis Viscay",
      "edad": null,
      "fecha": "2023-11-28",
      "fechaAprox": false,
      "cat": "extrajudicial",
      "sub": null,
      "prov": "CU-14",
      "lugar": "Guantánamo",
      "pais": "Cuba",
      "salida": null,
      "ruta": null,
      "estado": "muerto",
      "detalle": "Custodia policial: la policía dijo que se ahorcó, pero el cadáver tenía hematomas y ninguna marca en el cuello."
    },
    {
      "id": "c10",
      "nombre": "Pablo Moya Delá",
      "edad": 65,
      "fecha": "2023-07-01",
      "fechaAprox": true,
      "cat": "custodia",
      "sub": "huelga",
      "prov": "CU-13",
      "lugar": "Santiago de Cuba",
      "pais": "Cuba",
      "salida": null,
      "ruta": null,
      "estado": "muerto",
      "detalle": "Preso político; murió en el 40º día de una huelga de hambre en protesta por una paliza y exigiendo atención médica."
    },
    {
      "id": "c11",
      "nombre": "Carlos Galindo Ruiz",
      "edad": null,
      "fecha": "2023-05-16",
      "fechaAprox": false,
      "cat": "custodia",
      "sub": "medica",
      "prov": "CU-05",
      "lugar": "Hospital Arnaldo Milián, Santa Clara",
      "pais": "Cuba",
      "salida": null,
      "ruta": null,
      "estado": "muerto",
      "detalle": "Muerte en custodia por razones médicas / denegación de atención médica."
    },
    {
      "id": "c12",
      "nombre": "Luis Hernández Valdivia",
      "edad": null,
      "fecha": "2023-07-11",
      "fechaAprox": false,
      "cat": "custodia",
      "sub": "medica",
      "prov": "CU-01",
      "lugar": "Prisión San Juan y Martínez #4, Pinar del Río",
      "pais": "Cuba",
      "salida": null,
      "ruta": null,
      "estado": "muerto",
      "detalle": "Muerte en custodia por denegación de atención médica."
    },
    {
      "id": "c13",
      "nombre": "\"Kiko\" Pineda",
      "edad": null,
      "fecha": "2023-07-12",
      "fechaAprox": false,
      "cat": "custodia",
      "sub": "medica",
      "prov": "CU-09",
      "lugar": "Hospital Amalia Simoní, Camagüey",
      "pais": "Cuba",
      "salida": null,
      "ruta": null,
      "estado": "muerto",
      "detalle": "Muerte en custodia por razones médicas."
    },
    {
      "id": "c14",
      "nombre": "Lázaro Almenares Álvarez",
      "edad": null,
      "fecha": "2023-09-05",
      "fechaAprox": false,
      "cat": "custodia",
      "sub": "medica",
      "prov": "CU-12",
      "lugar": "Prisión Las Mangas, Bayamo, Granma",
      "pais": "Cuba",
      "salida": null,
      "ruta": null,
      "estado": "muerto",
      "detalle": "Muerte en custodia por denegación de atención médica."
    },
    {
      "id": "c15",
      "nombre": "Rafael Mojena Jerez",
      "edad": null,
      "fecha": "2023-09-05",